[
  {
    "conversionId": "6f1d2c3b-0000-4000-8000-00000000a001",
    "submittedAt": 1789748400000,
    "pageUrl": "https://openart.ai/enterprise?gclid=Cj0KCQjwSYNTHgclidLEAD1",
    "values": [
      {
        "objectTypeId": "0-1",
        "name": "firstname",
        "value": "Avery"
      },
      {
        "objectTypeId": "0-1",
        "name": "lastname",
        "value": "Synthetic"
      },
      {
        "objectTypeId": "0-1",
        "name": "company",
        "value": "Synthetic Brand Co"
      },
      {
        "objectTypeId": "0-1",
        "name": "jobtitle",
        "value": "Head of Creative"
      },
      {
        "objectTypeId": "0-1",
        "name": "company_size",
        "value": "101-1,000"
      },
      {
        "objectTypeId": "0-1",
        "name": "email",
        "value": "lead.one@synthetic-brand.example.test"
      },
      {
        "objectTypeId": "0-1",
        "name": "message",
        "value": "Video ads at scale for our brand team."
      },
      {
        "objectTypeId": "0-1",
        "name": "lead_source",
        "value": "Event"
      },
      {
        "objectTypeId": "0-1",
        "name": "latest_form_submit_url",
        "value": "https://openart.ai/enterprise/#contact"
      },
      {
        "objectTypeId": "0-1",
        "name": "gclid",
        "value": "Cj0KCQjwSYNTHgclidLEAD1"
      },
      {
        "objectTypeId": "0-1",
        "name": "lead_source_detail",
        "value": "Brandweek"
      }
    ]
  },
  {
    "conversionId": "6f1d2c3b-0000-4000-8000-00000000a002",
    "submittedAt": 1789897500000,
    "pageUrl": "https://openart.ai/enterprise",
    "values": [
      {
        "objectTypeId": "0-1",
        "name": "firstname",
        "value": "Jordan"
      },
      {
        "objectTypeId": "0-1",
        "name": "lastname",
        "value": "Synthetic"
      },
      {
        "objectTypeId": "0-1",
        "name": "company",
        "value": "Synthetic Studio"
      },
      {
        "objectTypeId": "0-1",
        "name": "jobtitle",
        "value": "Head of Creative"
      },
      {
        "objectTypeId": "0-1",
        "name": "company_size",
        "value": "11-100"
      },
      {
        "objectTypeId": "0-1",
        "name": "email",
        "value": "lead.two@synthetic-studio.example.test"
      },
      {
        "objectTypeId": "0-1",
        "name": "message",
        "value": "Video ads at scale for our brand team."
      },
      {
        "objectTypeId": "0-1",
        "name": "lead_source",
        "value": "Event"
      },
      {
        "objectTypeId": "0-1",
        "name": "latest_form_submit_url",
        "value": "https://openart.ai/enterprise/#contact"
      },
      {
        "objectTypeId": "0-1",
        "name": "lead_source_detail",
        "value": "Brandweek"
      }
    ]
  }
]
